[
  {
    "candidate_id": "concept-group-crypto-call",
    "nearest_analogues": [
      {
        "name": "Generic chatbot wrapper over a sponsor API",
        "source": "corpora/crowded-archetypes",
        "url": "",
        "similarities": {
          "same_user": false,
          "same_problem": false,
          "same_mechanism": false,
          "same_data": false,
          "same_action": false,
          "same_demo": false
        },
        "differences": [
          "User group is specific (friends), not generic; problem is social prediction settlement, not generic chatbot interaction.",
          "Mechanism involves on-chain constraint solving and NFT minting, not a simple API wrapper."
        ]
      },
      {
        "name": "Meeting notes / productivity chatbot",
        "source": "corpora/crowded-archetypes",
        "url": "",
        "similarities": {
          "same_user": false,
          "same_problem": false,
          "same_mechanism": false,
          "same_data": false,
          "same_action": false,
          "same_demo": false
        },
        "differences": [
          "Addresses a distinct social and on-chain settlement problem, not productivity or note-taking.",
          "Visible transformation is irrefutable on-chain record, not summarization or task management."
        ]
      }
    ],
    "collision_risk": "low",
    "observable_differentiator": "Automated, trustless settlement of social predictions via Solana constraint solver reading signed TxLINE data, minting NFTs as permanent proof.",
    "differentiator_is_substantive": true,
    "kill_recommendation": false,
    "notes": "Collision analysis against the crowded archetypes corpus reveals no substantive overlap. The candidate targets a highly specific user, problem (social prediction disputes during live sports), and technical mechanism (on-chain constraint solving against a verified data feed). These are not present in the nearest generic archetypes. The observable differentiator is clear and materially distinct."
  },
  {
    "candidate_id": "conc-feat-health",
    "nearest_analogues": [
      {
        "name": "Dashboard-only analytics without an irreversible state change",
        "source": "corpora/crowded-archetypes",
        "url": "",
        "similarities": {
          "same_user": true,
          "same_problem": false,
          "same_mechanism": false,
          "same_data": false,
          "same_action": false,
          "same_demo": false
        },
        "differences": [
          "The candidate achieves an irreversible, on-chain state change (storing anomalous Merkle roots) and sends alerts, unlike a read-only dashboard.",
          "Data source is a novel, cryptographically-signed feed (TxLINE) analyzed for integrity, not generic aggregated analytics."
        ]
      },
      {
        "name": "Symptom checker / triage chatbot",
        "source": "corpora/crowded-archetypes",
        "url": "",
        "similarities": {
          "same_user": false,
          "same_problem": false,
          "same_mechanism": false,
          "same_data": false,
          "same_action": false,
          "same_demo": false
        },
        "differences": [
          "Core domain is sports data feed integrity for algorithmic traders, not general health diagnostics.",
          "Mechanism is Merkle-root anomaly detection verified on Solana, not a medical triage decision tree."
        ]
      }
    ],
    "collision_risk": "low",
    "observable_differentiator": "A second-order integrity agent that actively cryptographically monitors TxLINE data health and stores verifiable proofs of anomalous windows on Solana.",
    "differentiator_is_substantive": true,
    "kill_recommendation": false,
    "notes": "Corpus comparison reveals only superficial user overlap with 'dashboard' archetypes, but the candidate's active, on-chain alerting and anomaly proof storage fundamentally differentiate it. No past winner or public project cited replicates this specific use of Merkle roots for a data feed's operational integrity, making collision risk low. The differentiator is substantive, leveraging the sponsor's data for a novel purpose."
  },
  {
    "candidate_id": "concept-1",
    "nearest_analogues": [
      {
        "name": "Nested — personalized city match (reference only)",
        "source": "corpora/past-winners",
        "url": "",
        "similarities": {
          "same_user": false,
          "same_problem": false,
          "same_mechanism": false,
          "same_data": false,
          "same_action": false,
          "same_demo": false
        },
        "differences": [
          "The candidate's user is a sports bettor verifying bet settlement, not a person relocating; problem is cryptographic verification of data, not preference matching.",
          "Mechanism is Merkle proof verification against an on-chain root, not personalized matching algorithms."
        ]
      },
      {
        "name": "Dashboard-only analytics without an irreversible state change",
        "source": "corpora/crowded-archetypes",
        "url": "",
        "similarities": {
          "same_user": false,
          "same_problem": false,
          "same_mechanism": false,
          "same_data": false,
          "same_action": false,
          "same_demo": false
        },
        "differences": [
          "The candidate performs a concrete, user-initiated verification action (input receipt, get green/red badge), not passive dashboard viewing.",
          "Relies on specific cryptographic primitives (Merkle proofs) and sponsor data (TxLINE), not general analytics."
        ]
      }
    ],
    "collision_risk": "low",
    "observable_differentiator": "A standalone, user-operated tool to cryptographically verify the fairness of any sports bet settlement against TxLINE's signed, Merkle-ized data.",
    "differentiator_is_substantive": true,
    "kill_recommendation": false,
    "notes": "No significant collision found. The candidate provides a concrete, cryptographic verification step not described in any past winner or crowded archetype. The combination of user (independent bettor), problem (trust in settlement), and mechanism (Merkle proof CPI verification) appears unique in the provided corpora."
  },
  {
    "candidate_id": "conc-replay-sandbox",
    "nearest_analogues": [
      {
        "name": "Generic chatbot wrapper over a sponsor API",
        "source": "corpora/crowded-archetypes",
        "url": "",
        "similarities": {
          "same_user": false,
          "same_problem": false,
          "same_mechanism": false,
          "same_data": false,
          "same_action": false,
          "same_demo": false
        },
        "differences": [
          "Target user is specifically a developer building on hackathon sponsors' data, with a developer-tool workflow (CLI, local endpoint), not a generic end-user chatbot.",
          "Mechanism is a configurable replay simulator with an on-chain audit trail, not a conversational wrapper."
        ]
      },
      {
        "name": "AI study tutor / quiz / flashcard generator",
        "source": "corpora/crowded-archetypes",
        "url": "",
        "similarities": {
          "same_user": false,
          "same_problem": false,
          "same_mechanism": false,
          "same_data": false,
          "same_action": false,
          "same_demo": false
        },
        "differences": [
          "Problem domain is developer tooling for deterministic data simulation, completely distinct from education.",
          "The end action results in on-chain provenance records, not personalized learning content."
        ]
      }
    ],
    "collision_risk": "low",
    "observable_differentiator": "A developer tool that replays historical World Cup data in a TxLINE-compatible format with on-chain CPI audit trails, enabling testing before live events exist.",
    "differentiator_is_substantive": true,
    "kill_recommendation": false,
    "notes": "The candidate's role as a specialized developer sandbox for a specific, time-sensitive hackathon need (pre-tournament testing) is not mirrored in the provided corpora. Its differentiator—generating verifiable, audited replay streams from static data, directly tied to a sponsor API—is materially distinct from the generic archetypes."
  }
]
